### ISSUE TITLE
Connection established but terminated immediately (SSL Handshake / Protocol issue?)

### ISSUE THREAD

**Issue by OpusTerra** [DevOldSchool/powermeter_hub_server#22]
Hi @DevOldSchool,

First of all, thank you for this project. I am trying to get my Efergy Hub (Bought in 2016) to report data to a local powermeter_hub_server instance on Ubuntu, but I've hit a wall regarding the data transmission.

Setup:

Server: Ubuntu running the Docker containers (hub-server, legacy-nginx).

Network: DNS spoofing implemented via dnsmasq. The hub correctly resolves sensornet.info to my Ubuntu local IP.

Connectivity: Port 443 is open and mapped to the legacy-nginx container.

The Problem: While the DNS redirection is successful, the hub fails to log any data to readings.db. I performed a tcpdump on the Ubuntu host to inspect the traffic from the Hub's IP (192.168.2.222), and it shows a TCP connection being established, some data being exchanged, and then the server (Ubuntu) sending a FIN packet immediately.

Tcpdump output:

Plaintext
14:32:28.579336 enp3s0 In  IP 192.168.2.222.2612 > ubuntu.https: Flags [S], seq 2697039312, win 1000
14:32:28.579364 enp3s0 Out IP ubuntu.https > 192.168.2.222.2612: Flags [S.], seq 4170098413, ack 2697039313, win 64240
14:32:28.594653 enp3s0 In  IP 192.168.2.222.2612 > ubuntu.https: Flags [P.], seq 6:53, ack 1, win 1000, length 47
14:32:28.595014 enp3s0 Out IP ubuntu.https > 192.168.2.222.2612: Flags [F.], seq 8, ack 53, win 64188, length 0
Observations:

The TCP handshake completes successfully.

The Hub sends a small payload (length 47), likely the start of the SSL/TLS handshake.

The server closes the connection (Flags [F.]) right after.

Nothing written in the logs.

Questions:

Do you have any leads on why the server might be rejecting the hub's request so early in the process?

Any help or guidance would be greatly appreciated!

**Comment by DevOldSchool** [comment]
Hey @OpusTerra, thanks for the details.

This sounds a lot like issues I had when first trying to setup the nginx server to accept the SSL connection from the hub.

Are you positive you don't have another service on this machine that is using port 443?
I'm suspecting you might have a newer version of nginx or apache running on this machine that is rejecting the connection due to the old SSL support.

--

Can you also confirm if you are building from source or using the hosted images?

--

Another troubleshooting step you can try is looking at the access logs on the nginx docker image.
The logs will be under /opt/nginx and both nano and vim are available.

Cheers.

**Comment by OpusTerra** [comment]
Hi @DevOldSchool,

Thanks for the quick follow-up and the suggestions.

To rule out any potential conflicts or hidden services on my current machine, I've decided to perform a fresh installation on a dedicated, clean environment. I will re-run the tests there and carefully inspect the internal Nginx logs (`/opt/nginx/logs/`) as you suggested if the issue persists. I'll get back to you with the results once the new setup is up and running. 

Regards,

Denis

**Comment by OpusTerra** [comment]
Hi,

Following up on my previous issues regarding `powermeter_hub_server`, I’ve now set up a **clean test environment** on a Raspberry Pi 4B (Debian 12, 64-bit, 4GB RAM) to avoid any interference from my production systems.

**Setup:**

* Using **hosted Docker images** for `hub-server` and `legacy-nginx`
* `hub-server` container: exposing port 5000/tcp
* `legacy-nginx` container: mapping host 443 to container 443 (0.0.0.0:443->443/tcp)
* **Self-signed TLS certificates** were generated and configured in `legacy-nginx` for HTTPS.
* DNS spoofing configured on the router for the Hub domains (`A5.2C.F1.001EC0.sensornet.info` and `A5.2C.F1.001EC0.keys.sensornet.info`) pointing to the Pi’s IP (192.168.2.244)

**Diagnostics:**

* `docker ps` shows:

```
CONTAINER ID   NAMES          PORTS
767b6aeac80a   hub-server     5000/tcp
edf5ff801f36   legacy-nginx   0.0.0.0:443->443/tcp, :::443->443/tcp
```

* `ss -lntp | grep :443` shows:

```
LISTEN 0      4096         0.0.0.0:443        0.0.0.0:*    users:(("docker-proxy",pid=4261,fd=4))
LISTEN 0      4096         [::]:443           [::]:*       users:(("docker-proxy",pid=4268,fd=4))
```

* `dig` confirms DNS spoofing works:

```
$ dig A5.2C.F1.001EC0.sensornet.info @192.168.2.244
;; ANSWER SECTION:
A5.2C.F1.001EC0.sensornet.info. 0 IN A 192.168.2.244
```

* `tcpdump` shows that the Hub **connects to port 443 only immediately after a reboot**, but **no traffic appears afterwards**:

```
192.168.2.222.1024 > 192.168.2.244.443: SYN
192.168.2.244.443 > 192.168.2.222.1024: SYN-ACK
192.168.2.222.1024 > 192.168.2.244.443: ACK
192.168.2.222.1024 > 192.168.2.244.443: PSH, some payload
```

**Problem:**

Despite the DNS redirection, `legacy-nginx` running, TLS certificates in place, and hosted Docker images, **the Hub-server is not receiving any POST data from the Hub**. Logs in both `hub-server` and `legacy-nginx` remain empty.

I suspect either:

1. The Hub requires some **specific TLS handshake/configuration** that `legacy-nginx` isn’t currently handling.
2. There’s a **configuration step missing** in `legacy-nginx` to properly forward the Hub’s requests to `hub-server`.

Since this is now running on a **dedicated test Pi**, interference from other services should not be an issue.

Any guidance on how to debug or configure `legacy-nginx` to correctly forward Efergy Hub HTTPS traffic to `hub-server` would be greatly appreciated.

Thanks!

**Comment by OpusTerra** [comment]
Hi,

Continuing from my previous issues, The hub-server is running in debug mode. After pointing my Efergy Hub DNS to the Pi and rebooting the hub, I see the following in the `hub_server` debug log:

```
2026-01-29 10:19:42,815 [DEBUG] hub_server.py:67 - >>> REQUEST: GET /check_key.html?p=E1&ts=00000000&h=f4d36e544e915ca9c45320144572f419
2026-01-29 10:19:42,815 [DEBUG] hub_server.py:68 - >>> Query params: {'p': ['E1'], 'ts': ['00000000'], 'h': ['f4d36e544e915ca9c45320144572f419']}
2026-01-29 10:19:42,815 [DEBUG] hub_server.py:69 - >>> Headers: {'Host': 'a5.2c.f1.001ec0.keys.sensornet.info', 'X-Real-IP': '192.168.2.222', 'X-Forwarded-For': '192.168.2.222', 'X-Forwarded-Proto': 'https', 'Connection': 'close'}
2026-01-29 10:19:42,816 [DEBUG] hub_server.py:70 - >>> Client: 172.18.0.3:58088
2026-01-29 10:19:42,816 [DEBUG] hub_server.py:181 - Key check from: a5.2c.f1.001ec0.keys.sensornet.info
2026-01-29 10:19:42,816 [DEBUG] hub_server.py:77 - <<< RESPONSE: 200 | Length: 7 | Content: 'success'
```

So far, after the hub reboot, I see traffic to `hub-server`, and key check requests appear exactly once per hub startup. However, subsequent GET or POST requests from the hub do not appear in the logs.

* Using hosted Docker images.
* Certificates have been generated for HTTPS.
* DNS spoofing configured correctly; initial requests are correctly routed to the Pi.
* TCP dump shows initial traffic immediately after hub reboot, but no further packets afterward.

I’m wondering if the hub may be caching results or disconnecting after the first key check.

Any advice on why the hub-server stops receiving requests after the first one?

**Comment by DevOldSchool** [comment]
Hey @OpusTerra , before we debug the nginx side further can you confirm the energy transmitter device has fresh batteries and you see a blinking light when pressing the button on the front?

**Comment by OpusTerra** [comment]
Hi @DevOldSchool,

 Yes — the energy transmitter has fresh batteries installed.
 When I press the front button, I do see the LED blinking as expected.

Additionally, I still have an **Elite Classic display** connected, and it continues to show my power consumption **in real time**, so the transmitter is definitely working and sending data correctly.

 Let me know what you’d like me to check next.

**Comment by DevOldSchool** [comment]
> Hi [@DevOldSchool](https://github.com/DevOldSchool),
> 
> Yes — the energy transmitter has fresh batteries installed. When I press the front button, I do see the LED blinking as expected.
> 
> Additionally, I still have an **Elite Classic display** connected, and it continues to show my power consumption **in real time**, so the transmitter is definitely working and sending data correctly.
> 
> Let me know what you’d like me to check next.

Thanks @OpusTerra .

Can you attach a terminal to the legacy-nginx image and navigate to /opt/nginx/logs and provide some logs from access.log and error.log.

We should see the attempts to post and errors in the log if it's failing in the SSL connection.

**Comment by OpusTerra** [comment]
Thanks @DevOldSchool,

I’ve attached a terminal to the legacy-nginx container and checked the logs under /opt/nginx/logs.

```
sudo docker exec -it legacy-nginx /bin/sh
# cd /opt/nginx/logs
# ls -l
total 8
-rw-r--r-- 1 root root    0 Jan 29 09:35 access.log
-rw-r--r-- 1 root root    0 Jan 29 09:35 error.log
-rw-r--r-- 1 root root    2 Jan 29 09:35 nginx.pid
-rw-r--r-- 1 root root 2016 Jan 31 02:05 proxy_access.log
# cat access.log
# cat error.log
# cat proxy_access.log
192.168.2.222 - - [29/Jan/2026:09:35:07 -0500] "GET /check_key.html?p=E1&ts=697B701A&h=37dab370500f045e13372861ead04ca5 HTTP/1.1" 200 7 "-" "-"
192.168.2.222 - - [29/Jan/2026:09:37:52 -0500] "GET /check_key.html?p=E1&ts=00000000&h=f4d36e544e915ca9c45320144572f419 HTTP/1.1" 200 7 "-" "-"
192.168.2.222 - - [29/Jan/2026:09:55:17 -0500] "GET /check_key.html?p=E1&ts=00000000&h=f4d36e544e915ca9c45320144572f419 HTTP/1.1" 200 7 "-" "-"
192.168.2.222 - - [29/Jan/2026:10:19:42 -0500] "GET /check_key.html?p=E1&ts=00000000&h=f4d36e544e915ca9c45320144572f419 HTTP/1.1" 200 7 "-" "-"
192.168.2.222 - - [29/Jan/2026:14:18:20 -0500] "GET /check_key.html?p=E1&ts=697BB27A&h=62f2e933142de880af02fcd9f1832f63 HTTP/1.1" 200 7 "-" "-"
192.168.2.222 - - [29/Jan/2026:18:16:56 -0500] "GET /check_key.html?p=E1&ts=697BEA67&h=1ce6700c236616e89299f5f1d1339107 HTTP/1.1" 200 7 "-" "-"
192.168.2.222 - - [29/Jan/2026:22:15:34 -0500] "GET /check_key.html?p=E1&ts=697C2254&h=477363d6c7581c971f5c99b22e981865 HTTP/1.1" 200 7 "-" "-"
192.168.2.222 - - [30/Jan/2026:02:14:11 -0500] "GET /check_key.html?p=E1&ts=697C5A41&h=7f5b7fce9e444cf3dfdc84fab1e7b82d HTTP/1.1" 200 7 "-" "-"
192.168.2.222 - - [30/Jan/2026:06:12:48 -0500] "GET /check_key.html?p=E1&ts=697C922E&h=de07702d5b894cb6f740a52a8908cf6a HTTP/1.1" 200 7 "-" "-"
192.168.2.222 - - [30/Jan/2026:10:11:25 -0500] "GET /check_key.html?p=E1&ts=697CCA1B&h=80d3cd8d71af3a1f2587c65793ddb821 HTTP/1.1" 200 7 "-" "-"
192.168.2.222 - - [30/Jan/2026:14:10:02 -0500] "GET /check_key.html?p=E1&ts=697D0208&h=b50a0b03402d67526854bddec5015b56 HTTP/1.1" 200 7 "-" "-"
192.168.2.222 - - [30/Jan/2026:18:08:39 -0500] "GET /check_key.html?p=E1&ts=697D39F6&h=ded6b49c6e664081e2fb73abb1e0b989 HTTP/1.1" 200 7 "-" "-"
192.168.2.222 - - [30/Jan/2026:22:07:16 -0500] "GET /check_key.html?p=E1&ts=697D71E3&h=38ec71f3eea225f1c01216395a6cda3d HTTP/1.1" 200 7 "-" "-"
192.168.2.222 - - [31/Jan/2026:02:05:53 -0500] "GET /check_key.html?p=E1&ts=697DA9D0&h=45c563a8ca755f8025ea3c3283d001c8 HTTP/1.1" 200 7 "-" "-"


```

access.log:
No entries corresponding to the transmitter activity. I don’t see any POST attempts or requests coming in when the hub is active.

error.log:
Also empty / no relevant SSL or connection errors logged during the same period.

===============

I also enabled DEBUG logging on the **hub-server container**.

The hub does receive requests and successfully validates the device key but that's all. Below is a sample from the logs:

sudo docker logs hub-server

```
2026-01-31 02:02:01,437 [DEBUG] mqtt_manager.py:113 - MQTT published to home/efergy/energy_consumption/energy: {"value": 0.0}
2026-01-31 02:05:53,857 [DEBUG] hub_server.py:66 - ================================================================================
2026-01-31 02:05:53,857 [DEBUG] hub_server.py:67 - >>> REQUEST: GET /check_key.html?p=E1&ts=697DA9D0&h=45c563a8ca755f8025ea3c3283d001c8
2026-01-31 02:05:53,858 [DEBUG] hub_server.py:68 - >>> Query params: {'p': ['E1'], 'ts': ['697DA9D0'], 'h': ['45c563a8ca755f8025ea3c3283d001c8']}
2026-01-31 02:05:53,858 [DEBUG] hub_server.py:69 - >>> Headers: {'Host': 'a5.2c.f1.001ec0.keys.sensornet.info', 'X-Real-IP': '192.168.2.222', 'X-Forwarded-For': '192.168.2.222', 'X-Forwarded-Proto': 'https', 'Connection': 'close'}
2026-01-31 02:05:53,858 [DEBUG] hub_server.py:70 - >>> Client: 172.18.0.3:42126
2026-01-31 02:05:53,859 [DEBUG] hub_server.py:181 - Key check from: a5.2c.f1.001ec0.keys.sensornet.info
2026-01-31 02:05:53,859 [DEBUG] hub_server.py:77 - <<< RESPONSE: 200 | Length: 7 | Content: 'success'
2026-01-31 02:07:01,438 [DEBUG] aggregator.py:35 - Aggregator processed 0 hours
2026-01-31 02:07:01,439 [DEBUG] mqtt_manager.py:225 - Publishing energy for energy_consumption with value 0.0
2026-01-31 02:07:01,440 [DEBUG] mqtt_manager.py:113 - MQTT published to home/efergy/energy_consumption/energy: {"value": 0.0}

```


Let me know if you’d like me to test a different configuration.

**Comment by DevOldSchool** [comment]
@OpusTerra , it sure sounds like the DNS routing is not correct.

Rereading your old messages, I see you had said the following:
```
DNS spoofing configured on the router for the Hub domains (A5.2C.F1.001EC0.sensornet.info and A5.2C.F1.001EC0.keys.sensornet.info) pointing to the Pi’s IP (192.168.2.244)
```

Note, if your hub is v2 or v3 the actual domain would be:
```
A5.2C.F1.001EC0.h2.sensornet.info
OR
A5.2C.F1.001EC0.h3.sensornet.info
```

Can you add both of those and see if that makes a difference.

**Comment by OpusTerra** [comment]
Hi @DevOldSchool,

Quick update — adding the `h2` / `h3` domains to DNS spoofing was the missing piece 👍  

After updating dnsmasq so that the following domains resolve to the Pi running nginx + hub-server:

- `A5.2C.F1.001EC0.h2.sensornet.info`
- `A5.2C.F1.001EC0.h3.sensornet.info`

…the hub immediately started POSTing data correctly.

I enabled debug logging on `hub_server` and I am now consistently seeing valid `/h3` POST requests, readings being stored, and MQTT messages published successfully.

Here is a representative log excerpt:


```
2026-02-01 00:44:24,791 [DEBUG] hub_server.py:67 - >>> REQUEST: POST /h3
2026-02-01 00:44:24,792 [DEBUG] hub_server.py:68 - >>> Query params: {}
2026-02-01 00:44:24,792 [DEBUG] hub_server.py:69 - >>> Headers: {'Host': 'a5.2c.f1.001ec0.h3.sensornet.info', 'X-Real-IP': '192.168.2.222', 'X-Forwarded-For': '192.168.2.222', 'X-Forwarded-Proto': 'https', 'Connection': 'close', 'Content-Length': '31', 'X-Hash': '2cf302166764f0f3', 'X-TS': '697EE837', 'X-Uptime': '226042', 'X-Version': '3.7.1', 'X-Mode': 'E1', 'X-Pair': 'P', 'Content-Type': 'application/eh-data'}
2026-02-01 00:44:24,793 [DEBUG] hub_server.py:70 - >>> Client: 172.18.0.3:33278
2026-02-01 00:44:24,793 [DEBUG] hub_server.py:208 - >>> POST body: 696495|0|EFCT|P1,78039.06|-59
2026-02-01 00:44:24,793 [DEBUG] hub_server.py:304 - Logging sensor: efergy_h3_696495, raw: 78039.06
2026-02-01 00:44:24,794 [DEBUG] database.py:234 - Inserted reading: efergy_h3_696495 (1), 78039.06
2026-02-01 00:44:24,795 [DEBUG] mqtt_manager.py:206 - Publishing power for efergy_h3_696495 with value 78039.06
2026-02-01 00:44:24,796 [DEBUG] mqtt_manager.py:113 - MQTT published to home/efergy/efergy_h3_696495/power: {"value": 78039.06}
2026-02-01 00:44:24,797 [DEBUG] hub_server.py:77 - <<< RESPONSE: 200 | Length: 7 | Content: 'success'
```

And subsequent POSTs continue normally (multiple sensors, sequential updates).

So root cause was confirmed to be:

- DNS override was initially only done for `sensornet.info` / `keys.sensornet.info`
- Hub v3 actually posts data to `*.h3.sensornet.info`

Once that was corrected, everything worked end-to-end:

Hub → nginx (SSL) → hub_server → SQLite → MQTT.

Thanks a lot for pointing me in the right direction — this fully resolves the issue on my side.
